Nama Produk,Harga Produk,Produk Terjual
Grinder Kopi Manual Portable Penggiling Biji Kopi Manual,Rp150.000,90+ terjual
Gilingan Kopi BIJI Manual Ceramic Manual Handy Coffee Grinder stainles,Rp59.000,2rb+ terjual
New Timemore Chestnut C3s Hand Coffee Grinder Alat Giling Kopi Manual,Rp670.000,750+ terjual
Latina Flores Mini coffee grinder gilingan kopi manual,Rp242.000,7 terjual
Vocory Grinder Kopi Travel Elektrik Semi Automatic Manual 120 ML,Rp259.000,9 terjual
Timemore Chesnut C3 coffee grinder manual | penggilng biji kopi,Rp635.000,1rb+ terjual
New Timemore Chestnut C3s Hand Coffee Grinder Alat Giling Kopi Manual,Rp670.000,750+ terjual
Timemore Chestnut C3s Pro Hand Coffee Grinder Manual Alat Giling Kopi,Rp895.000,100+ terjual
1Zpresso ZP6 Special Manual Coffee Grinder,Rp3.250.000,100+ terjual
Manual Hand Coffee Grinder / Coffee Maker / Penggiling Kopi,Rp45.999,1rb+ terjual
Grinder Kopi Manual Portable Penggiling Biji Kopi Manual,Rp150.000,90+ terjual
Gilingan Kopi BIJI Manual Ceramic Manual Handy Coffee Grinder stainles,Rp59.000,2rb+ terjual
New Timemore Chestnut C3s Hand Coffee Grinder Alat Giling Kopi Manual,Rp670.000,750+ terjual
Latina Flores Mini coffee grinder gilingan kopi manual,Rp242.000,7 terjual
Grinder Coffee Hand Manual G1 Stainless burr / Penggiling Biji Kopi 5 Star Burr,Rp360.000,1 terjual
Timemore Chesnut C3 coffee grinder manual | penggilng biji kopi,Rp635.000,1rb+ terjual
New Timemore Chestnut C3s Hand Coffee Grinder Alat Giling Kopi Manual,Rp670.000,750+ terjual
Timemore Chestnut C3s Pro Hand Coffee Grinder Manual Alat Giling Kopi,Rp895.000,100+ terjual
1Zpresso ZP6 Special Manual Coffee Grinder,Rp3.250.000,100+ terjual
Manual Hand Coffee Grinder / Coffee Maker / Penggiling Kopi,Rp45.999,1rb+ terjual
LATINA T60 Libra | Coffee Grinder | Manual Brew Espresso | T-60 600N - Hijau,Rp1.780.000,100+ terjual
Timemore Chesnut C3 coffee grinder manual | penggilng biji kopi - Putih,Rp635.000,100+ terjual
Alat Penggiling Kopi Manual Coffee Grinder Stainless Steel Hand Grind,Rp75.000,500+ terjual
Hario - Penggiling Biji Kopi Manual Ceramic Coffee Mill Skerton MSCSN-2-B,Rp740.000,1 terjual
LATINA T60 LIBRA coffee Grinder manual brew & espresso gilingan kopi - Hijau,Rp1.980.000,70+ terjual
1zpresso Q Air Manual Coffee Grinder,Rp995.000,20 terjual
Handy Mill Coffee Grinder TOSO SLIMO TS12 Gilingan Kopi Manual,Rp112.000,100+ terjual
Manual Coffee Grinder Stainless SW-118 Alat Penggiling Biji Kopi,Rp144.900,5 terjual
Comandante - Coffee Grinder C40 Nitro Blade (American Cherry) - Penggiling Biji Kopi Manual,Rp4.990.000,90+ terjual
ACE - Kris Coffee Grinder Manual Ms Jar,Rp159.900,27 terjual
COFFEE GRINDER MANUAL ADJUSTABLE / GRINDER KOPI MANUAL ZX-A65,Rp98.800,50+ terjual
PENGGILING KOPI MANUAL COFFEE GRINDER ANTIK KLASIK RETRO VINTAGE,Rp89.000,30+ terjual
SMEG EGF03 Espresso Manual Coffee Machine with Grinder,Rp20.500.000,5 terjual
Alat Penggiling Kopi Manual Klasik Coffee Grinder Kayu Adjustable,Rp129.999,8 terjual
Mazzer - Omega Hand Coffee Grinder - Penggiling Biji Kopi Manual,Rp7.950.000,1 terjual
MHW 3Bomber Racing M1-Manual Coffee Grinder,Rp840.000,1 terjual
OneTwoCups Alat Penggiling Kopi Manual Coffee Grinder - CF4146,Rp74.700,21 terjual
Coffee Grinder setainles Gilingan Biji Kopi Manual Ceramic,Rp135.000,18 terjual
timemore manual coffee grinder chestnut ESP perfect for espresso kopi,Rp1.450.000,10 terjual
Travel Hand Manual Grinder Ceramic Burr Small Ukuran Kecil Giling Kopi,Rp80.850,100+ terjual
HOMADISE Coffee Grinder Manual / Alat Penggiling Kopi Manual CF012 ,Rp78.800,40+ terjual
Alat Penggiling Kopi Manual Hand Grinder Beans Coffee Adjustable,Rp135.700,26 terjual
Pietro Manual Coffee Grinder,Rp1.950.000,4 terjual
LATINA T60 Coffee Grinder Espresso Manual Brew Gilingan Kopi Elektrik,Rp1.750.000,18 terjual
Timemore Chestnut C3s Pro Max Hand Coffee Grinder Alat Giling Manual,Rp965.000,8 terjual
Comandante - Coffee Grinder C40 Nitro Blade (Black) - Penggiling Biji Kopi Manual,Rp4.990.000,30+ terjual
Grinder Kopi Elektrik Penggiling Coffee Elektrik Serbaguna 400W,Rp239.000,1rb+ terjual
GRINDER KOPI TIMEMORE CHESTNUT S3 COFFEE GRINDER S2C 890 BURR,Rp1.285.000,100+ terjual
Mahlkonig - Coffee Grinder (EK43) - Black Mesin Penggiling Biji Kopi,Rp49.400.000,12 terjual
Grinder Kopi Espresso Mazzer Mini D - Garansi Resmi,Rp9.000.000,50+ terjual
Grinder Kopi Comandante C40 MK4 Nitro Blade Coffee Grinder,Rp4.750.000,40+ terjual
Penggiling Biji Kopi Manual Coffee Grinder Adjustable ,Rp78.900,3 terjual
Kopi Arabika Toraja 1Kg Grade1 Basic Blend/Espresso/Manual V60/Tubruk Kopi Giling/Kopi Bubuk/Kopi Biji/Kopi Sangrai/Kopi Roasted/Kopi Siap Seduh,Rp100.000,7 terjual
Alat Penggiling Biji Kopi Manual Coffee Grinder Stainless Steel E14,Rp76.750,27 terjual
ROK Coffee Grinder (Grinder manual dari sang pembuat ROK Presso),Rp3.499.000,40+ terjual
iCafilas Alat Penggiling Kopi Manual Coffee Grinder Adjustable,Rp126.300,3 terjual
"Fiorenzato F64 EVO Espresso coffee grinder gilingan kopi automatic - Putih, FREE PALET KAYU",Rp15.642.100,20 terjual
Profesional Coffee Grinder JX 600 Pengiling kopi barista espresso - Putih,Rp4.475.000,100+ terjual
MHW-3BOMBER Racing M1-Manual Coffee Grinder 38mm Six Star CNC420 Stainless Steel Bur (including a B5525B Pen Brush) / coffee grinder manual alat penggiling biji kopi hand coffee grinder one circle 24 grids coffee bean berkualitas original MHW 3 BOMBER,Rp850.000,4 terjual
PAKET COFFEE GRINDER + MOKA POT 6 CUP-300 ml (ALAT SEDUH KOPI MANUAL),Rp155.000,100+ terjual
Alat Penggiling Kopi - Manual Coffee Grinder Adjustable - Pembuat Kopi,Rp54.000,16 terjual
Paket Kopi - Manual Grinder - Vietnam Drip,Rp104.900,7 terjual
iCafilas Professional Manual Coffee Grinder - Alat Giling Biji Kopi,Rp622.000,2 terjual
Coffee Grinder Manual / Penggiling Kopi / Ceramic Grinder Compact,Rp89.900,4 terjual
Latina Gemini C40 Espresso Coffee Grinder Manual Brew,Rp2.685.000,29 terjual
ROK Coffee Grinder (Grinder manual dari sang pembuat ROK Presso),Rp3.499.000,40+ terjual
Mini Manual Coffee Grinder,Rp88.000,100+ terjual
AMAZONE HOT SELLING HIGH QUALITY MANUAL COFFEE GRINDER BLACK COLOUR,Rp499.800,3 terjual
"Grinder Latina T60 Libra 150W / Coffee Grinder Manual Brew,  Espresso",Rp1.800.000,6 terjual
Paketan Manual Brewing V60 Brewista Kettle & Coffee Grinder 500N,Rp4.495.000,2 terjual
Handy Manual Coffee Grinder Mill Grinder Kopi -Penggiling Kopi,Rp95.000,30+ terjual
Staresso SP200 Classic Combo Travel Manual Handy Espresso Coffee Maker And Grinder Kopi,Rp1.449.000,1 terjual
Grinder Kopi Manual Portable Penggiling Biji Kopi Manual,Rp150.000,90+ terjual
Gilingan Kopi BIJI Manual Ceramic Manual Handy Coffee Grinder stainles,Rp59.000,2rb+ terjual
New Timemore Chestnut C3s Hand Coffee Grinder Alat Giling Kopi Manual,Rp670.000,750+ terjual
Grinder Coffee Hand Manual G1 Stainless burr / Penggiling Biji Kopi 5 Star Burr,Rp360.000,1 terjual
Kinu - Simplicity M47 Coffee Grinder - Penggiling Biji Kopi Manual,Rp5.850.000,11 terjual
Portable Hand Coffee Grinder Alat Pengiling Kopi Manual Electric USB,Rp199.500,6 terjual
Alat Penggiling Kopi Manual Coffee Grinder - RH200,Rp20.000,3 terjual
Manual Hand Coffee Grinder Heptagonal 38mm 7Core Titanium Conical Burr,Rp1.599.000,5 terjual
Hand Coffee Grinder Manual Stainless Steel Alat Penggiling Kopi,Rp99.900,40+ terjual
One Two Cups Penggiling Biji Kopi Elektrik Coffee Grinder 50g 150W ,Rp147.250,2 terjual
Alat Penggiling Kopi Manual Coffee Grinder Waterproof Easy Clean,Rp91.955,1 terjual
KinGrinder K2 Manual Coffee Grinder Iron Grey,Rp1.290.000,7 terjual
MOKHAMANO MANUAL COFFEE GRINDER ALAT PENGGILING KOPI BLACK JNRH200,Rp80.600,50+ terjual
Coffee Grinder Manual - Penggiling Kopi - Ceramic Coffee Grinder,Rp99.900,40+ terjual
Latina Sumba Handy Coffee Grinder | Penggiling Biji Kopi Manual,Rp160.000,750+ terjual
Manual Coffee Grinder Klasik / Gilingan Kopi Manual Cyprus,Rp150.000,70+ terjual
Alat Kopi Latina 600N Electric Coffee Grinder - Penggiling Kopi Elektr,Rp2.150.000,250+ terjual
Electric Coffee Grinder N500 | Grinder Kopi | Mesin Giling Kopi - SILVER,Rp1.425.000,100+ terjual
Latina T60 Libra Espresso Kopi Elektrik Coffee Grinder Electric 600N,Rp1.780.000,750+ terjual
COFFEE GRINDER ELECTRIC / MESIN PENGGILING BIJI KOPI ELEKTRIK TYGOLIFE,Rp245.000,1rb+ terjual
Penggiling Kopi Coffee Grinder Manual Stainless Steel bukan Porlex,Rp60.000,13 terjual
gilingan kopi manual / manual coffee grinder,Rp58.000,1rb+ terjual
Kopi Arabika Brasil Kopi Import/Kopi Luar Negeri Kopi 1Kg Grade1 Basic Blend/Espreso/Manual V60/Tubruk Kopi Giling/Kopi Bubuk/Kopi Biji/Kopi Sangrai/Kopi Roasted/Kopi Siap Seduh,Rp105.000,5 terjual
Gilingan Kopi Manual Fleco - Penggiling Kopi Portable - Coffee Grinder,Rp64.000,60+ terjual
Grinder Kopi Manual Portable Penggiling Biji Kopi Manual,Rp150.000,90+ terjual
Gilingan Kopi BIJI Manual Ceramic Manual Handy Coffee Grinder stainles,Rp59.000,2rb+ terjual
New Timemore Chestnut C3s Hand Coffee Grinder Alat Giling Kopi Manual,Rp670.000,750+ terjual
Latina Flores Mini coffee grinder gilingan kopi manual,Rp242.000,7 terjual
Grinder Coffee Hand Manual G1 Stainless burr / Penggiling Biji Kopi 5 Star Burr,Rp360.000,1 terjual
Grinder Kopi Manual Coffee Hand Manual Grinder Penggiling Biji Kopi,Rp95.000,60+ terjual
Penggiling Biji Kopi Manual Coffee Grinder Kayu Pengaturan Tekstur,Rp90.300,1 terjual
Gilingan Kopi Manual - Coffee Grinder Stainless Steel burr keramik,Rp250.000,8 terjual
LATINA T60 Libra | Coffee Grinder | Manual Brew Espresso | T-60 600N - Hijau,Rp1.780.000,100+ terjual
Timemore Chesnut C3 coffee grinder manual | penggilng biji kopi - Putih,Rp635.000,100+ terjual
Alat Penggiling Kopi Manual Coffee Grinder Stainless Steel Hand Grind,Rp75.000,500+ terjual
Hario - Penggiling Biji Kopi Manual Ceramic Coffee Mill Skerton MSCSN-2-B,Rp740.000,1 terjual
LATINA T60 LIBRA coffee Grinder manual brew & espresso gilingan kopi - Hijau,Rp1.980.000,70+ terjual
Grinder kopi manual alat penggiling kopi manual homadise - hitam,Rp95.000,1 terjual
Alat Kopi Manual Brewing Grinder Electric V60 Gooseneck Coffee Maker,Rp817.400,3 terjual
Manual coffee grinder free glass / kopi grinder manual / gilingan kopi,Rp85.000,100+ terjual
PENGGILING KOPI MANUAL COFFEE GRINDER ANTIK KLASIK RETRO VINTAGE,Rp89.000,30+ terjual
Alat Penggiling Kopi Manual Klasik Coffee Grinder Kayu Adjustable,Rp129.999,8 terjual
SMEG EGF03 Espresso Manual Coffee Machine with Grinder,Rp20.500.000,5 terjual
iCafilas Professional Manual Coffee Grinder - Alat Giling Biji Kopi,Rp624.000,3 terjual
Grinder Kopi Manual Coffee Hand Grinder Stainless Penggiling Kopi,Rp135.000,27 terjual
COFFEE GRINDER MANUAL PENGGILING KOPI MANUAL DENGAN GEAR KERAMIK,Rp99.500,4 terjual
Coffee Bean Grinder Stainles Steel Manual Penggiling Biji Kopi,Rp106.000,1 terjual
Travel Hand Manual Grinder Ceramic Burr Small Ukuran Kecil Giling Kopi,Rp80.850,100+ terjual
HOMADISE Coffee Grinder Manual / Alat Penggiling Kopi Manual CF012 ,Rp78.800,40+ terjual
Alat Penggiling Kopi Manual Hand Grinder Beans Coffee Adjustable,Rp135.700,26 terjual
Gilingan Kopi / Jagung / Lada / Kacang Manual Serbaguna,Rp235.000,25 terjual
Alat Penggiling Kopi Manual Coffee Grinder - RHNHA0176 - Black,Rp86.999,2 terjual
Flextreme CGM-01 Coffee Grinder - Penggiling Kopi Manual /Coffee Maker,Rp91.000,1 terjual
N500 Electric Coffee Grinder espresso | Penggiling Kopi espresso,Rp1.650.000,60+ terjual
Grinder Kopi Espresso N500 Auto [Bellezofa],Rp2.750.000,60+ terjual
jinsei coffee grinder penggiling kopi 420 conical burr 7 cores js-822 - Hitam,Rp2.998.000,7 terjual
GRINDER KOPI TIMEMORE CHESTNUT S3 COFFEE GRINDER S2C 890 BURR,Rp1.285.000,100+ terjual
Original LATINA 600N coffee Grinder gilingan kopi bonus 1kg arabika - Kuning,Rp2.288.000,750+ terjual
Manual Coffee Grinder Stainless Stell,Rp100.000,5 terjual
Manual Coffee Grinder Glass (portable) / Alat penggiling kopi manual,Rp99.900,6 terjual
DF64V single dose coffee grinder penggiling kopi espresso manual brew ,Rp9.499.000,1 terjual
Grinder Kopi Manual Antik Retro Vintage Muranee SW014,Rp67.900,30+ terjual
LATINA T60 coffee Grinder manual brew & espresso gilingan kopi - Abu-abu,Rp1.980.000,250+ terjual
Adjustable Travel Coffee Grinder Manual with Stainless Steel Burr - Abu-abu,Rp773.800,2 terjual
Latina Gemini C40 Espresso Coffee Grinder Manual Brew,Rp2.685.000,29 terjual
Alat Penggiling Kopi Antik Manual Classic Retro Antique Coffee Grinder,Rp220.000,4 terjual
Paket v60 coffee manual serve 400ml+grinder+driper+kertas filter kopi,Rp283.000,4 terjual
Grinder Kopi Manual Alat Penggiling Kopi Manual Coffee Grinder - RH200,Rp66.900,19 terjual
Mini Manual Coffee Grinder,Rp88.000,100+ terjual
Hario - Coffee Mill Octo MOC-3TB Penggiling Biji Kopi Manual - Grinder,Rp865.000,26 terjual
GATER COFFEE GRINDER ( GLASS ) MANUAL / Penggiling Kopi Gater Manual,Rp135.000,5 terjual
ONE TWO CUPS Alat Penggiling Kopi Manual Coffee Grinder - CF4146,Rp73.500,24 terjual
Hand Grinder Stainless Ceramic Burr Penggiling Kopi Manual Kemarik,Rp80.850,100+ terjual
Portable Hand Coffee Grinder Alat Pengiling Kopi Manual Electric USB,Rp199.500,6 terjual
Timemore Chestnut C3esp Coffee Grinder| Penggiling Biji Kopi Portable,Rp1.349.000,40+ terjual
coffee grinder penggiling kopi espresso v60 420 conical burr fu-2038,Rp1.100.000,3 terjual
Timemore Chestnut C3 Coffee Grinder| Penggiling Biji Kopi Portable,Rp659.000,750+ terjual
Alat Kopi Paket Hemat Alat Kopi Manual Brew V60 Grinder Coffee Maker,Rp860.000,3 terjual
Alat Penggiling Kopi Manual Coffee Grinder Adjustable One Two Cups,Rp84.060,1 terjual
Coffee Grinder Part - Burr Clip S,Rp14.000,1rb+ terjual
SMEG CGF01 Coffee Grinder,Rp4.350.000,40+ terjual
Hand Coffee Grinder Manual Stainless Steel Alat Penggiling Kopi,Rp99.900,40+ terjual
Alat Penggiling Kopi Manual Coffee Grinder Waterproof Easy Clean,Rp91.955,1 terjual
Yajiao Alat Penggiling Kopi Manual Coffee Grinder Portable - EC03,Rp95.648,1 terjual
